{
  "principal_id": "11111111-1111-4111-8111-111111111111",
  "principal_type": "user",
  "display_name": "Synthetic User",
  "organization_id": "22222222-2222-4222-8222-222222222222",
  "project_id": "33333333-3333-4333-8333-333333333333",
  "groups": ["data-stewards", "test-engineers"],
  "scopes": ["openid", "profile"],
  "request_id": "44444444-4444-4444-8444-444444444444",
  "trace_id": "00-4bf92f3577b34da6a3ce929d0e0e4736-00f067aa0ba902b7-01"
}
